{
  "schema": "promptbranch.orchestration.accepted_event",
  "schema_version": "1.0",
  "event_id": "k8s-game-mvp.G5_release_deployment.accepted.fixture.v1",
  "project": {
    "id": "k8s-game-mvp",
    "role": "orchestration-model-test-vehicle"
  },
  "baseline": {
    "artifact_ref": "chatgpt_claudecode_workflow-2_v0.1.79.zip",
    "artifact_version": "v0.1.79",
    "source_ref": "chatgpt_claudecode_workflow-2_v0.1.79.zip",
    "source_version": "v0.1.79",
    "role": "accepted_current_source_baseline"
  },
  "source_grill": {
    "path": "docs/design/orchestration/examples/grills/G5_release_deployment.example.json",
    "stage": "G5_release_deployment",
    "sha256": "341cfb9f7b660a6d562d00d63788d36ee06abf56ade4596f1a89d18cde11d353"
  },
  "accepted_transition": {
    "from": "implementation_candidate",
    "to": "artifact_verified",
    "reason": "The release/deployment grill recommendation is accepted as a committed read-only fixture only; this release does not mutate runtime workflow state."
  },
  "decision": "accepted",
  "constraints": {
    "fixture_only": true,
    "runtime_state_mutation_allowed": false,
    "source_mutation_allowed": false,
    "artifact_adoption_allowed": false,
    "deployment_allowed": false,
    "model_may_execute": false,
    "promptbranch_must_validate": true
  },
  "evidence": {
    "validated_by": [
      "scripts/orchestration/validate_grill.py",
      "scripts/orchestration/validate_accepted_event.py"
    ],
    "validation_status": "read_only_fixture_validated",
    "validation_notes": [
      "The source grill envelope is valid.",
      "The accepted transition matches the source grill recommendation and the k8s-game MVP state machine.",
      "The accepted event fixture is data only and cannot mutate source, artifacts, deployment, or runtime workflow state."
    ]
  },
  "notes": "This fixture proves the proposal-to-accepted-event validation boundary without recording live workflow state."
}
